"Key","Item Type","Publication Year","Author","Title","Publication Title","ISBN","ISSN","DOI","Url","Abstract Note","Date","Date Added","Date Modified","Access Date","Pages","Num Pages","Issue","Volume","Number Of Volumes","Journal Abbreviation","Short Title","Series","Series Number","Series Text","Series Title","Publisher","Place","Language","Rights","Type","Archive","Archive Location","Library Catalog","Call Number","Extra","Notes","File Attachments","Link Attachments","Manual Tags","Automatic Tags","Editor","Series Editor","Translator","Contributor","Attorney Agent","Book Author","Cast Member","Commenter","Composer","Cosponsor","Counsel","Interviewer","Producer","Recipient","Reviewed Author","Scriptwriter","Words By","Guest","Number","Edition","Running Time","Scale","Medium","Artwork Size","Filing Date","Application Number","Assignee","Issuing Authority","Country","Meeting Name","Conference Name","Court","References","Reporter","Legal Status","Priority Numbers","Programming Language","Version","System","Code","Code Number","Section","Session","Committee","History","Legislative Body"
"IWYP7FEC","journalArticle","2017","Biffi, A.; Kuramatsu, J. B.; Leasure, A.; Kamel, H.; Kourkoulis, C.; Schwab, K.; Ayres, A. M.; Elm, J.; Gurol, M. E.; Greenberg, S. M.; Viswanathan, A.; Anderson, C. D.; Schwab, S.; Rosand, J.; Testai, F. D.; Woo, D.; Huttner, H. B.; Sheth, K. N.","Oral Anticoagulation and Functional Outcome after Intracerebral Hemorrhage","Ann Neurol","","0364-5134","10.1002/ana.25079","","","2017","2020-11-01 12:02:11","2020-11-01 12:02:11","","755-765","","5","82","","","","","","","","","","","","","","","","","Type: Journal Article","","","","","","","","","","","","","","","","","","","","","","","","","","","","","","","","","","","","","","","","","","","","","","","","","","",""
"YL3JI3YF","journalArticle","2019","Carcel, C.; Wang, X.; Sandset, E. C.; Delcourt, C.; Arima, H.; Lindley, R.; Hackett, M. L.; Lavados, P.; Robinson, T. G.; Munoz Venturelli, P.; Olavarria, V. V.; Brunser, A.; Berge, E.; Chalmers, J.; Woodward, M.; Anderson, C. S.","Sex differences in treatment and outcome after stroke: Pooled analysis including 19,000 participants","Neurology","","0028-3878","10.1212/wnl.0000000000008615","","","2019","2020-11-01 12:02:12","2020-11-01 12:02:12","","","","","","","","","","","","","","","","","","","","","","Type: Journal Article","","","","","","","","","","","","","","","","","","","","","","","","","","","","","","","","","","","","","","","","","","","","","","","","","","",""
"NRRW5XDB","journalArticle","2018","Cooper, Y. A.; Pianka, S. T.; Alotaibi, N. M.; Babayan, D.; Salavati, B.; Weil, A. G.; Ibrahim, G. M.; Wang, A. C.; Fallah, A.","Repetitive transcranial magnetic stimulation for the treatment of drug-resistant epilepsy: A systematic review and individual participant data meta-analysis of real-world evidence","Epilepsia Open","","2470-9239 (Print) 2470-9239","10.1002/epi4.12092","","","2018","2020-11-01 12:02:12","2020-11-01 12:02:12","","55-65","","1","3","","","","","","","","","","","","","","","","","Type: Journal Article","","","","","","","","","","","","","","","","","","","","","","","","","","","","","","","","","","","","","","","","","","","","","","","","","","",""
"UDD8NVHZ","journalArticle","2018","Cummings, M. H.; Cao, D.; Hadjiyianni, I.; Ilag, L. L.; Tan, M. H.","Characteristics of insulin-Naive people with type 2 diabetes who successfully respond to insulin glargine U100 after 24 weeks of treatment: a meta-analysis of individual participant data from 3 randomized clinical trials","Clin Diabetes Endocrinol","","2055-8260 (Print) 2055-8260","10.1186/s40842-018-0059-2","","","2018","2020-11-01 12:02:12","2020-11-01 12:02:12","","10","","","4","","","","","","","","","","","","","","","","","Type: Journal Article","","","","","","","","","","","","","","","","","","","","","","","","","","","","","","","","","","","","","","","","","","","","","","","","","","",""
"RNMIBXSN","journalArticle","2015","Karyotaki, E.; Kleiboer, A.; Smit, F.; Turner, D. T.; Pastor, A. M.; Andersson, G.; Berger, T.; Botella, C.; Breton, J. M.; Carlbring, P.; Christensen, H.; de Graaf, E.; Griffiths, K.; Donker, T.; Farrer, L.; Huibers, M. J.; Lenndin, J.; Mackinnon, A.; Meyer, B.; Moritz, S.; Riper, H.; Spek, V.; Vernmark, K.; Cuijpers, P.","Predictors of treatment dropout in self-guided web-based interventions for depression: an 'individual patient data' meta-analysis","Psychol Med","","0033-2917","10.1017/s0033291715000665","","","2015","2020-11-01 12:02:12","2020-11-01 12:02:12","","2717-26","","13","45","","","","","","","","","","","","","","","","","Type: Journal Article","","","","","","","","","","","","","","","","","","","","","","","","","","","","","","","","","","","","","","","","","","","","","","","","","","",""
"XMTU2HRT","journalArticle","2017","van Eijk, R. P. A.; Jones, A. R.; Sproviero, W.; Shatunov, A.; Shaw, P. J.; Leigh, P. N.; Young, C. A.; Shaw, C. E.; Mora, G.; Mandrioli, J.; Borghero, G.; Volanti, P.; Diekstra, F. P.; van Rheenen, W.; Verstraete, E.; Eijkemans, M. J. C.; Veldink, J. H.; Chio, A.; Al-Chalabi, A.; van den Berg, L. H.; van Es, M. A.","Meta-analysis of pharmacogenetic interactions in amyotrophic lateral sclerosis clinical trials","Neurology","","0028-3878","10.1212/wnl.0000000000004606","","","2017","2020-11-01 12:02:12","2020-11-01 12:02:12","","1915-1922","","18","89","","","","","","","","","","","","","","","","","Type: Journal Article","","","","","","","","","","","","","","","","","","","","","","","","","","","","","","","","","","","","","","","","","","","","","","","","","","",""