"MED2GPN8","journalArticle","2018","Romero, R.; Conde-Agudelo, A.; Da Fonseca, E.; O'Brien, J. M.; Cetingoz, E.; Creasy, G. W.; Hassan, S. S.; Nicolaides, K. H.","Vaginal progesterone for preventing preterm birth and adverse perinatal outcomes in singleton gestations with a short cervix: a meta-analysis of individual patient data","Am J Obstet Gynecol","","0002-9378","10.1016/j.ajog.2017.11.576","","","2018","2020-11-01 12:00:52","2020-11-01 12:00:52","","161-180","","2","218","","","","","","","","","","","","","","","","","Type: Journal Article","","","","","","","","","","","","","","","","","","","","","","","","","","","","","","","","","","","","","","","","","","","","","","","","","","",""
"DEATS9Y5","journalArticle","2017","Romero, R.; Conde-Agudelo, A.; El-Refaie, W.; Rode, L.; Brizot, M. L.; Cetingoz, E.; Serra, V.; Da Fonseca, E.; Abdelhafez, M. S.; Tabor, A.; Perales, A.; Hassan, S. S.; Nicolaides, K. H.","Vaginal progesterone decreases preterm birth and neonatal morbidity and mortality in women with a twin gestation and a short cervix: an updated meta-analysis of individual patient data","Ultrasound Obstet Gynecol","","0960-7692","10.1002/uog.17397","","","2017","2020-11-01 12:00:52","2020-11-01 12:00:52","","303-314","","3","49","","","","","","","","","","","","","","","","","Type: Journal Article","","","","","","","","","","","","","","","","","","","","","","","","","","","","","","","","","","","","","","","","","","","","","","","","","","",""
"9Q4PPZSG","journalArticle","2017","Ronellenfitsch, U.; Schwarzbach, M.; Hofheinz, R.; Kienle, P.; Nowak, K.; Kieser, M.; Slanger, T. E.; Burmeister, B.; Kelsen, D.; Niedzwiecki, D.; Schuhmacher, C.; Urba, S.; van de Velde, C.; Walsh, T. N.; Ychou, M.; Jensen, K.","Predictors of overall and recurrence-free survival after neoadjuvant chemotherapy for gastroesophageal adenocarcinoma: Pooled analysis of individual patient data (IPD) from randomized controlled trials (RCTs)","Eur J Surg Oncol","","0748-7983","10.1016/j.ejso.2017.05.005","","","2017","2020-11-01 12:00:52","2020-11-01 12:00:52","","1550-1558","","8","43","","","","","","","","","","","","","","","","","Type: Journal Article","","","","","","","","","","","","","","","","","","","","","","","","","","","","","","","","","","","","","","","","","","","","","","","","","","",""
"XQLFG9ZD","journalArticle","2015","Rose, L.; Schultz, M. J.; Cardwell, C. R.; Jouvet, P.; McAuley, D. F.; Blackwood, B.","Automated versus non-automated weaning for reducing the duration of mechanical ventilation for critically ill adults and children: a cochrane systematic review and meta-analysis","Crit Care","","1364-8535","10.1186/s13054-015-0755-6","","","2015","2020-11-01 12:00:53","2020-11-01 12:00:53","","48","","","19","","","","","","","","","","","","","","","","","Type: Journal Article","","","","","","","","","","","","","","","","","","","","","","","","","","","","","","","","","","","","","","","","","","","","","","","","","","",""
"H3RNIUN4","journalArticle","2019","Rosenfield, D.; Smits, J. A. J.; Hofmann, S. G.; Mataix-Cols, D.; de la Cruz, L. F.; Andersson, E.; Ruck, C.; Monzani, B.; Perez-Vigil, A.; Frumento, P.; Davis, M.; de Kleine, R. A.; Difede, J.; Dunlop, B. W.; Farrell, L. J.; Geller, D.; Gerardi, M.; Guastella, A. J.; Hendriks, G. J.; Kushner, M. G.; Lee, F. S.; Lenze, E. J.; Levinson, C. A.; McConnell, H.; Plag, J.; Pollack, M. H.; Ressler, K. J.; Rodebaugh, T. L.; Rothbaum, B. O.; Storch, E. A.; Strohle, A.; Tart, C. D.; Tolin, D. F.; van Minnen, A.; Waters, A. M.; Weems, C. F.; Wilhelm, S.; Wyka, K.; Altemus, M.; Anderson, P.; Cukor, J.; Finck, C.; Geffken, G. R.; Golfels, F.; Goodman, W. K.; Gutner, C. A.; Heyman, I.; Jovanovic, T.; Lewin, A. B.; McNamara, J. P.; Murphy, T. K.; Norrholm, S.; Thuras, P.; Turner, C.; Otto, M. W.","Changes in Dosing and Dose Timing of D-Cycloserine Explain Its Apparent Declining Efficacy for Augmenting Exposure Therapy for Anxiety-related Disorders: An Individual Participant-data Meta-analysis","J Anxiety Disord","","0887-6185","10.1016/j.janxdis.2019.102149","","","2019","2020-11-01 12:00:53","2020-11-01 12:00:53","","102149","","","68","","","","","","","","","","","","","","","","","Type: Journal Article","","","","","","","","","","","","","","","","","","","","","","","","","","","","","","","","","","","","","","","","","","","","","","","","","","",""
"RBWGMNNL","journalArticle","2019","Rozental, A.; Andersson, G.; Carlbring, P.","In the Absence of Effects: An Individual Patient Data Meta-Analysis of Non-response and Its Predictors in Internet-Based Cognitive Behavior Therapy","Front Psychol","","1664-1078 (Print) 1664-1078","10.3389/fpsyg.2019.00589","","","2019","2020-11-01 12:00:53","2020-11-01 12:00:53","","589","","","10","","","","","","","","","","","","","","","","","Type: Journal Article","","","","","","","","","","","","","","","","","","","","","","","","","","","","","","","","","","","","","","","","","","","","","","","","","","",""
"7PENAXH2","journalArticle","2017","Runhaar, J.; Rozendaal, R. M.; van Middelkoop, M.; Bijlsma, H. J. W.; Doherty, M.; Dziedzic, K. S.; Lohmander, L. S.; McAlindon, T.; Zhang, W.; Bierma Zeinstra, S.","Subgroup analyses of the effectiveness of oral glucosamine for knee and hip osteoarthritis: a systematic review and individual patient data meta-analysis from the OA trial bank","Ann Rheum Dis","","0003-4967","10.1136/annrheumdis-2017-211149","","","2017","2020-11-01 12:00:53","2020-11-01 12:00:53","","1862-1869","","11","76","","","","","","","","","","","","","","","","","Type: Journal Article","","","","","","","","","","","","","","","","","","","","","","","","","","","","","","","","","","","","","","","","","","","","","","","","","","",""
"G7HJGN2Z","journalArticle","2015","Saccone, G.; Rust, O.; Althuisius, S.; Roman, A.; Berghella, V.","Cerclage for short cervix in twin pregnancies: systematic review and meta-analysis of randomized trials using individual patient-level data","Acta Obstet Gynecol Scand","","0001-6349","10.1111/aogs.12600","","","2015","2020-11-01 12:00:53","2020-11-01 12:00:53","","352-8","","4","94","","","","","","","","","","","","","","","","","Type: Journal Article","","","","","","","","","","","","","","","","","","","","","","","","","","","","","","","","","","","","","","","","","","","","","","","","","","",""
"6ZDHEZQK","journalArticle","2018","Saczkowski, R. S.; Brown, D. J. A.; Abu-Laban, R. B.; Fradet, G.; Schulze, C. J.; Kuzak, N. D.","Prediction and risk stratification of survival in accidental hypothermia requiring extracorporeal life support: An individual patient data meta-analysis","Resuscitation","","0300-9572","10.1016/j.resuscitation.2018.03.028","","","2018","2020-11-01 12:00:53","2020-11-01 12:00:53","","51-57","","","127","","","","","","","","","","","","","","","","","Type: Journal Article","","","","","","","","","","","","","","","","","","","","","","","","","","","","","","","","","","","","","","","","","","","","","","","","","","",""
"DCMTQ7H8","journalArticle","2015","Sahgal, A.; Aoyama, H.; Kocher, M.; Neupane, B.; Collette, S.; Tago, M.; Shaw, P.; Beyene, J.; Chang, E. L.","Phase 3 trials of stereotactic radiosurgery with or without whole-brain radiation therapy for 1 to 4 brain metastases: individual patient data meta-analysis","Int J Radiat Oncol Biol Phys","","0360-3016","10.1016/j.ijrobp.2014.10.024","","","2015","2020-11-01 12:00:53","2020-11-01 12:00:53","","710-7","","4","91","","","","","","","","","","","","","","","","","Type: Journal Article","","","","","","","","","","","","","","","","","","","","","","","","","","","","","","","","","","","","","","","","","","","","","","","","","","",""
"QH9T4H28","journalArticle","2017","Samara, M. T.; Goldberg, Y.; Levine, S. Z.; Furukawa, T. A.; Geddes, J. R.; Cipriani, A.; Davis, J. M.; Leucht, S.","Initial symptom severity of bipolar I disorder and the efficacy of olanzapine: a meta-analysis of individual participant data from five placebo-controlled studies","Lancet Psychiatry","","2215-0366","10.1016/s2215-0366(17)30331-0","","","2017","2020-11-01 12:00:53","2020-11-01 12:00:53","","859-867","","11","4","","","","","","","","","","","","","","","","","Type: Journal Article","","","","","","","","","","","","","","","","","","","","","","","","","","","","","","","","","","","","","","","","","","","","","","","","","","",""
"NXV2TQRR","journalArticle","2016","Sarcina, C.; Tinelli, C.; Ferrario, F.; Pani, A.; De Silvestri, A.; Scaini, P.; Del Vecchio, L.; Alberghini, E.; Buzzi, L.; Baragetti, I.; Pozzi, C.","Changes in Proteinuria and Side Effects of Corticosteroids Alone or in Combination with Azathioprine at Different Stages of IgA Nephropathy","Clin J Am Soc Nephrol","","1555-9041","10.2215/cjn.02300215","","","2016","2020-11-01 12:00:53","2020-11-01 12:00:53","","973-81","","6","11","","","","","","","","","","","","","","","","","Type: Journal Article","","","","","","","","","","","","","","","","","","","","","","","","","","","","","","","","","","","","","","","","","","","","","","","","","","",""
"YYI7Q6IW","journalArticle","2016","Sattar, N.; Preiss, D.; Robinson, J. G.; Djedjos, C. S.; Elliott, M.; Somaratne, R.; Wasserman, S. M.; Raal, F. J.","Lipid-lowering efficacy of the PCSK9 inhibitor evolocumab (AMG 145) in patients with type 2 diabetes: a meta-analysis of individual patient data","Lancet Diabetes Endocrinol","","2213-8587","10.1016/s2213-8587(16)00003-6","","","2016","2020-11-01 12:00:53","2020-11-01 12:00:53","","403-10","","5","4","","","","","","","","","","","","","","","","","Type: Journal Article","","","","","","","","","","","","","","","","","","","","","","","","","","","","","","","","","","","","","","","","","","","","","","","","","","",""
"KFSJ2W3J","journalArticle","2016","Saver, J. L.; Goyal, M.; van der Lugt, A.; Menon, B. K.; Majoie, C. B.; Dippel, D. W.; Campbell, B. C.; Nogueira, R. G.; Demchuk, A. M.; Tomasello, A.; Cardona, P.; Devlin, T. G.; Frei, D. F.; du Mesnil de Rochemont, R.; Berkhemer, O. A.; Jovin, T. G.; Siddiqui, A. H.; van Zwam, W. H.; Davis, S. M.; Castano, C.; Sapkota, B. L.; Fransen, P. S.; Molina, C.; van Oostenbrugge, R. J.; Chamorro, A.; Lingsma, H.; Silver, F. L.; Donnan, G. A.; Shuaib, A.; Brown, S.; Stouch, B.; Mitchell, P. J.; Davalos, A.; Roos, Y. B.; Hill, M. D.","Time to Treatment With Endovascular Thrombectomy and Outcomes From Ischemic Stroke: A Meta-analysis","Jama","","0098-7484","10.1001/jama.2016.13647","","","2016","2020-11-01 12:00:53","2020-11-01 12:00:53","","1279-88","","12","316","","","","","","","","","","","","","","","","","Type: Journal Article","","","","","","","","","","","","","","","","","","","","","","","","","","","","","","","","","","","","","","","","","","","","","","","","","","",""
"5DVJJVLD","journalArticle","2017","Sawaya, F. J.; Morice, M. C.; Spaziano, M.; Mehran, R.; Didier, R.; Roy, A.; Valgimigli, M.; Kim, H. S.; Woo Park, K.; Hong, M. K.; Kim, B. K.; Jang, Y.; Feres, F.; Abizaid, A.; Costa, R. A.; Colombo, A.; Chieffo, A.; Giustino, G.; Stone, G. W.; Bhatt, D. L.; Palmerini, T.; Gilard, M.","Short-versus long-term Dual Antiplatelet therapy after drug-eluting stent implantation in women versus men: A sex-specific patient-level pooled-analysis of six randomized trials","Catheter Cardiovasc Interv","","1522-1946","10.1002/ccd.26653","","","2017","2020-11-01 12:00:53","2020-11-01 12:00:53","","178-189","","2","89","","","","","","","","","","","","","","","","","Type: Journal Article","","","","","","","","","","","","","","","","","","","","","","","","","","","","","","","","","","","","","","","","","","","","","","","","","","",""
"RAR5NXPU","journalArticle","2019","Schneider, P. A.; Laird, J. R.; Doros, G.; Gao, Q.; Ansel, G.; Brodmann, M.; Micari, A.; Shishehbor, M. H.; Tepe, G.; Zeller, T.","Mortality Not Correlated With Paclitaxel Exposure: An Independent Patient-Level Meta-Analysis of a Drug-Coated Balloon","J Am Coll Cardiol","","0735-1097","10.1016/j.jacc.2019.01.013","","","2019","2020-11-01 12:00:53","2020-11-01 12:00:53","","2550-2563","","20","73","","","","","","","","","","","","","","","","","Type: Journal Article","","","","","","","","","","","","","","","","","","","","","","","","","","","","","","","","","","","","","","","","","","","","","","","","","","",""
"2GG6FFTG","journalArticle","2019","Schonenberger, S.; Henden, P. L.; Simonsen, C. Z.; Uhlmann, L.; Klose, C.; Pfaff, J. A. R.; Yoo, A. J.; Sorensen, L. H.; Ringleb, P. A.; Wick, W.; Kieser, M.; Mohlenbruch, M. A.; Rasmussen, M.; Rentzos, A.; Bosel, J.","Association of General Anesthesia vs Procedural Sedation With Functional Outcome Among Patients With Acute Ischemic Stroke Undergoing Thrombectomy: A Systematic Review and Meta-analysis","Jama","","0098-7484","10.1001/jama.2019.11455","","","2019","2020-11-01 12:00:54","2020-11-01 12:00:54","","1283-1293","","13","322","","","","","","","","","","","","","","","","","Type: Journal Article","","","","","","","","","","","","","","","","","","","","","","","","","","","","","","","","","","","","","","","","","","","","","","","","","","",""
"3DI94IDA","journalArticle","2019","Schruers, K.; Baldi, S.; van den Heuvel, T.; Goossens, L.; Luyten, L.; Leentjens, A. F. G.; Ackermans, L.; Temel, Y.; Viechtbauer, W.","The effects of deep-brain non-stimulation in severe obsessive-compulsive disorder: an individual patient data meta-analysis","Transl Psychiatry","","2158-3188","10.1038/s41398-019-0522-6","","","2019","2020-11-01 12:00:54","2020-11-01 12:00:54","","183","","1","9","","","","","","","","","","","","","","","","","Type: Journal Article","","","","","","","","","","","","","","","","","","","","","","","","","","","","","","","","","","","","","","","","","","","","","","","","","","",""
"U4KL6BST","journalArticle","2018","Schuetz, P.; Wirz, Y.; Sager, R.; Christ-Crain, M.; Stolz, D.; Tamm, M.; Bouadma, L.; Luyt, C. E.; Wolff, M.; Chastre, J.; Tubach, F.; Kristoffersen, K. B.; Burkhardt, O.; Welte, T.; Schroeder, S.; Nobre, V.; Wei, L.; Bucher, H. C.; Annane, D.; Reinhart, K.; Falsey, A. R.; Branche, A.; Damas, P.; Nijsten, M.; de Lange, D. W.; Deliberato, R. O.; Oliveira, C. F.; Maravic-Stojkovic, V.; Verduri, A.; Beghe, B.; Cao, B.; Shehabi, Y.; Jensen, J. S.; Corti, C.; van Oers, J. A. H.; Beishuizen, A.; Girbes, A. R. J.; de Jong, E.; Briel, M.; Mueller, B.","Effect of procalcitonin-guided antibiotic treatment on mortality in acute respiratory infections: a patient level meta-analysis","Lancet Infect Dis","","1473-3099","10.1016/s1473-3099(17)30592-3","","","2018","2020-11-01 12:00:54","2020-11-01 12:00:54","","95-107","","1","18","","","","","","","","","","","","","","","","","Type: Journal Article","","","","","","","","","","","","","","","","","","","","","","","","","","","","","","","","","","","","","","","","","","","","","","","","","","",""
"CNBRUQZH","journalArticle","2015","Schuit, E.; Stock, S.; Rode, L.; Rouse, D. J.; Lim, A. C.; Norman, J. E.; Nassar, A. H.; Serra, V.; Combs, C. A.; Vayssiere, C.; Aboulghar, M. M.; Wood, S.; Cetingoz, E.; Briery, C. M.; Fonseca, E. B.; Worda, K.; Tabor, A.; Thom, E. A.; Caritis, S. N.; Awwad, J.; Usta, I. M.; Perales, A.; Meseguer, J.; Maurel, K.; Garite, T.; Aboulghar, M. A.; Amin, Y. M.; Ross, S.; Cam, C.; Karateke, A.; Morrison, J. C.; Magann, E. F.; Nicolaides, K. H.; Zuithoff, N. P.; Groenwold, R. H.; Moons, K. G.; Kwee, A.; Mol, B. W.","Effectiveness of progestogens to improve perinatal outcome in twin pregnancies: an individual participant data meta-analysis","Bjog","","1470-0328","10.1111/1471-0528.13032","","","2015","2020-11-01 12:00:54","2020-11-01 12:00:54","","27-37","","1","122","","","","","","","","","","","","","","","","","Type: Journal Article","","","","","","","","","","","","","","","","","","","","","","","","","","","","","","","","","","","","","","","","","","","","","","","","","","",""
"8D3TIIHK","journalArticle","2019","Seidu, S.; Kunutsor, S. K.; Sesso, H. D.; Gaziano, J. M.; Buring, J. E.; Roncaglioni, M. C.; Khunti, K.","Aspirin has potential benefits for primary prevention of cardiovascular outcomes in diabetes: updated literature-based and individual participant data meta-analyses of randomized controlled trials","Cardiovasc Diabetol","","1475-2840","10.1186/s12933-019-0875-4","","","2019","2020-11-01 12:00:54","2020-11-01 12:00:54","","70","","1","18","","","","","","","","","","","","","","","","","Type: Journal Article","","","","","","","","","","","","","","","","","","","","","","","","","","","","","","","","","","","","","","","","","","","","","","","","","","",""
"YXGETSNM","journalArticle","2015","Serpa Neto, A.; Hemmes, S. N.; Barbas, C. S.; Beiderlinden, M.; Biehl, M.; Binnekade, J. M.; Canet, J.; Fernandez-Bustamante, A.; Futier, E.; Gajic, O.; Hedenstierna, G.; Hollmann, M. W.; Jaber, S.; Kozian, A.; Licker, M.; Lin, W. Q.; Maslow, A. D.; Memtsoudis, S. G.; Reis Miranda, D.; Moine, P.; Ng, T.; Paparella, D.; Putensen, C.; Ranieri, M.; Scavonetto, F.; Schilling, T.; Schmid, W.; Selmo, G.; Severgnini, P.; Sprung, J.; Sundar, S.; Talmor, D.; Treschan, T.; Unzueta, C.; Weingarten, T. N.; Wolthuis, E. K.; Wrigge, H.; Gama de Abreu, M.; Pelosi, P.; Schultz, M. J.","Protective versus Conventional Ventilation for Surgery: A Systematic Review and Individual Patient Data Meta-analysis","Anesthesiology","","0003-3022","10.1097/aln.0000000000000706","","","2015","2020-11-01 12:00:54","2020-11-01 12:00:54","","66-78","","1","123","","","","","","","","","","","","","","","","","Type: Journal Article","","","","","","","","","","","","","","","","","","","","","","","","","","","","","","","","","","","","","","","","","","","","","","","","","","",""
"GRBQ9LQI","journalArticle","2018","Serpa Neto, A.; Juffermans, N. P.; Hemmes, S. N. T.; Barbas, C. S. V.; Beiderlinden, M.; Biehl, M.; Fernandez-Bustamante, A.; Futier, E.; Gajic, O.; Jaber, S.; Kozian, A.; Licker, M.; Lin, W. Q.; Memtsoudis, S. G.; Miranda, D. R.; Moine, P.; Paparella, D.; Ranieri, M.; Scavonetto, F.; Schilling, T.; Selmo, G.; Severgnini, P.; Sprung, J.; Sundar, S.; Talmor, D.; Treschan, T.; Unzueta, C.; Weingarten, T. N.; Wolthuis, E. K.; Wrigge, H.; de Abreu, M. G.; Pelosi, P.; Schultz, M. J.","Interaction between peri-operative blood transfusion, tidal volume, airway pressure and postoperative ARDS: an individual patient data meta-analysis","Ann Transl Med","","2305-5839 (Print) 2305-5839","10.21037/atm.2018.01.16","","","2018","2020-11-01 12:00:54","2020-11-01 12:00:54","","23","","2","6","","","","","","","","","","","","","","","","","Type: Journal Article","","","","","","","","","","","","","","","","","","","","","","","","","","","","","","","","","","","","","","","","","","","","","","","","","","",""
"A8Q78QQ8","journalArticle","2015","Seshasai, S. R.; Bennett, R. L.; Petrie, J. R.; Bengus, M.; Ekman, S.; Dixon, M.; Herz, M.; Buse, J. B.; Ray, K. K.","Cardiovascular safety of the glucagon-like peptide-1 receptor agonist taspoglutide in people with type 2 diabetes: an individual participant data meta-analysis of randomized controlled trials","Diabetes Obes Metab","","1462-8902","10.1111/dom.12448","","","2015","2020-11-01 12:00:54","2020-11-01 12:00:54","","505-10","","5","17","","","","","","","","","","","","","","","","","Type: Journal Article","","","","","","","","","","","","","","","","","","","","","","","","","","","","","","","","","","","","","","","","","","","","","","","","","","",""
"2QSVJ7B9","journalArticle","2019","Shaffer, M. L.; Baud, O.; Lacaze-Masmonteil, T.; Peltoniemi, O. M.; Bonsante, F.; Watterberg, K. L.","Effect of Prophylaxis for Early Adrenal Insufficiency Using Low-Dose Hydrocortisone in Very Preterm Infants: An Individual Patient Data Meta-Analysis","J Pediatr","","0022-3476","10.1016/j.jpeds.2018.10.004","","","2019","2020-11-01 12:00:55","2020-11-01 12:00:55","","136-142.e5","","","207","","","","","","","","","","","","","","","","","Type: Journal Article","","","","","","","","","","","","","","","","","","","","","","","","","","","","","","","","","","","","","","","","","","","","","","","","","","",""
"WA5FIZ48","journalArticle","2016","Shin, D. H.; Hong, S. J.; Mintz, G. S.; Kim, J. S.; Kim, B. K.; Ko, Y. G.; Choi, D.; Jang, Y.; Hong, M. K.","Effects of Intravascular Ultrasound-Guided Versus Angiography-Guided New-Generation Drug-Eluting Stent Implantation: Meta-Analysis With Individual Patient-Level Data From 2,345 Randomized Patients","JACC Cardiovasc Interv","","1936-8798","10.1016/j.jcin.2016.07.021","","","2016","2020-11-01 12:00:55","2020-11-01 12:00:55","","2232-2239","","21","9","","","","","","","","","","","","","","","","","Type: Journal Article","","","","","","","","","","","","","","","","","","","","","","","","","","","","","","","","","","","","","","","","","","","","","","","","","","",""
"8JIHAG4L","journalArticle","2016","Shu, H.; Gu, L. N.; Men, L. C.; Lu, J. M.","Lixisenatide Improves Glycemic Control in Asian Type 2 Diabetic Patients Inadequately Controlled With Oral Antidiabetic Drugs: An Individual Patient Data Meta-Analysis","Diabetes Ther","","1869-6953 (Print)","10.1007/s13300-016-0207-6","","","2016","2020-11-01 12:00:55","2020-11-01 12:00:55","","777-792","","4","7","","","","","","","","","","","","","","","","","Type: Journal Article","","","","","","","","","","","","","","","","","","","","","","","","","","","","","","","","","","","","","","","","","","","","","","","","","","",""
"IQEUY7R7","journalArticle","2015","Siervo, M.; Lara, J.; Jajja, A.; Sutyarjoko, A.; Ashor, A. W.; Brandt, K.; Qadir, O.; Mathers, J. C.; Benjamin, N.; Winyard, P. G.; Anning, C.; Shore, A.; Gilchrist, M.","Ageing modifies the effects of beetroot juice supplementation on 24-hour blood pressure variability: An individual participant meta-analysis","Nitric Oxide","","1089-8603","10.1016/j.niox.2015.04.007","","","2015","2020-11-01 12:00:55","2020-11-01 12:00:55","","97-105","","","47","","","","","","","","","","","","","","","","","Type: Journal Article","","","","","","","","","","","","","","","","","","","","","","","","","","","","","","","","","","","","","","","","","","","","","","","","","","",""
"DRGY9ULM","journalArticle","2018","Smelt, A. F.; Gussekloo, J.; Bermingham, L. W.; Allen, E.; Dangour, A. D.; Eussen, S. J.; Favrat, B.; De Groot, L. C.; Kok, F. J.; Kwok, T.; Mangoni, A. A.; Ntaios, G.; Van De Rest, O.; Seal, E.; Vaucher, P.; Verhoef, P.; Stijnen, T.; Den Elzen, W. P.","The effect of vitamin B12 and folic acid supplementation on routine haematological parameters in older people: an individual participant data meta-analysis","Eur J Clin Nutr","","0954-3007","10.1038/s41430-018-0118-x","","","2018","2020-11-01 12:00:55","2020-11-01 12:00:55","","785-795","","6","72","","","","","","","","","","","","","","","","","Type: Journal Article","","","","","","","","","","","","","","","","","","","","","","","","","","","","","","","","","","","","","","","","","","","","","","","","","","",""
"2UT9E9U5","journalArticle","2018","Spertus, J.; Horvitz-Lennon, M.; Abing, H.; Normand, S. L.","Risk of weight gain for specific antipsychotic drugs: a meta-analysis","NPJ Schizophr","","2334-265X (Print) 2334-265x","10.1038/s41537-018-0053-9","","","2018","2020-11-01 12:00:55","2020-11-01 12:00:55","","12","","1","4","","","","","","","","","","","","","","","","","Type: Journal Article","","","","","","","","","","","","","","","","","","","","","","","","","","","","","","","","","","","","","","","","","","","","","","","","","","",""
"2NKIXBXR","journalArticle","2017","Staykov, D.; Kuramatsu, J. B.; Bardutzky, J.; Volbers, B.; Gerner, S. T.; Kloska, S. P.; Doerfler, A.; Schwab, S.; Huttner, H. B.","Efficacy and safety of combined intraventricular fibrinolysis with lumbar drainage for prevention of permanent shunt dependency after intracerebral hemorrhage with severe ventricular involvement: A randomized trial and individual patient data meta-analysis","Ann Neurol","","0364-5134","10.1002/ana.24834","","","2017","2020-11-01 12:00:55","2020-11-01 12:00:55","","93-103","","1","81","","","","","","","","","","","","","","","","","Type: Journal Article","","","","","","","","","","","","","","","","","","","","","","","","","","","","","","","","","","","","","","","","","","","","","","","","","","",""
"27BZ4NQZ","journalArticle","2018","Stein, C.; Migliavaca, C. B.; Colpani, V.; da Rosa, P. R.; Sganzerla, D.; Giordani, N. E.; Miguel, Srps; Cruz, L. N.; Polanczyk, C. A.; Ribeiro, A. L. P.; Falavigna, M.","Amiodarone for arrhythmia in patients with Chagas disease: A systematic review and individual patient data meta-analysis","PLoS Negl Trop Dis","","1935-2727","10.1371/journal.pntd.0006742","","","2018","2020-11-01 12:00:55","2020-11-01 12:00:55","","e0006742","","8","12","","","","","","","","","","","","","","","","","Type: Journal Article","","","","","","","","","","","","","","","","","","","","","","","","","","","","","","","","","","","","","","","","","","","","","","","","","","",""
"FW8QF4IE","journalArticle","2019","Stone, G. W.; Kimura, T.; Gao, R.; Kereiakes, D. J.; Ellis, S. G.; Onuma, Y.; Chevalier, B.; Simonton, C.; Dressler, O.; Crowley, A.; Ali, Z. A.; Serruys, P. W.","Time-Varying Outcomes With the Absorb Bioresorbable Vascular Scaffold During 5-Year Follow-up: A Systematic Meta-analysis and Individual Patient Data Pooled Study","JAMA Cardiol","","","10.1001/jamacardio.2019.4101","","","2019","2020-11-01 12:00:55","2020-11-01 12:00:55","","","","","","","","","","","","","","","","","","","","","","Type: Journal Article","","","","","","","","","","","","","","","","","","","","","","","","","","","","","","","","","","","","","","","","","","","","","","","","","","",""
