"Key","Item Type","Publication Year","Author","Title","Publication Title","ISBN","ISSN","DOI","Url","Abstract Note","Date","Date Added","Date Modified","Access Date","Pages","Num Pages","Issue","Volume","Number Of Volumes","Journal Abbreviation","Short Title","Series","Series Number","Series Text","Series Title","Publisher","Place","Language","Rights","Type","Archive","Archive Location","Library Catalog","Call Number","Extra","Notes","File Attachments","Link Attachments","Manual Tags","Automatic Tags","Editor","Series Editor","Translator","Contributor","Attorney Agent","Book Author","Cast Member","Commenter","Composer","Cosponsor","Counsel","Interviewer","Producer","Recipient","Reviewed Author","Scriptwriter","Words By","Guest","Number","Edition","Running Time","Scale","Medium","Artwork Size","Filing Date","Application Number","Assignee","Issuing Authority","Country","Meeting Name","Conference Name","Court","References","Reporter","Legal Status","Priority Numbers","Programming Language","Version","System","Code","Code Number","Section","Session","Committee","History","Legislative Body"
"3EVXPDZ9","journalArticle","2017","","Serious Adverse Events with Bevacizumab or Ranibizumab for Age-related Macular Degeneration: Meta-analysis of Individual Patient Data","Ophthalmol Retina","","2468-7219 (Print) 2468-6530","10.1016/j.oret.2016.12.015","","","2017","2020-11-01 12:00:37","2020-11-01 12:00:37","","375-381","","5","1","","","","","","","","","","","","","","","","","Type: Journal Article","","","","","","","","","","","","","","","","","","","","","","","","","","","","","","","","","","","","","","","","","","","","","","","","","","",""
"RVTEDJW9","journalArticle","2015","Abdulla, S.; Ashley, E. A.; Bassat, Q.; Bethell, D.; Bjorkman, A.; Borrmann, S.; D'Alessandro, U.; Dahal, P.; Day, N. P.; Diakite, M.; Djimde, A. A.; Dondorp, A. M.; Duong, S.; Edstein, M. D.; Fairhurst, R. M.; Faiz, M. A.; Falade, C.; Flegg, J. A.; Fogg, C.; Gonzalez, R.; Greenwood, B.; Guerin, P. J.; Guthmann, J. P.; Hamed, K.; Hien, T. T.; Htut, Y.; Juma, E.; Lim, P.; Martensson, A.; Mayxay, M.; Mokuolu, O. A.; Moreira, C.; Newton, P.; Noedl, H.; Nosten, F.; Ogutu, B. R.; Onyamboko, M. A.; Owusu-Agyei, S.; Phyo, A. P.; Premji, Z.; Price, R. N.; Pukrittayakamee, S.; Ramharter, M.; Sagara, I.; Se, Y.; Suon, S.; Stepniewska, K.; Ward, S. A.; White, N. J.; Winstanley, P. A.","Baseline data of parasite clearance in patients with falciparum malaria treated with an artemisinin derivative: an individual patient data meta-analysis","Malar J","","1475-2875","10.1186/s12936-015-0874-1","","","2015","2020-11-01 12:00:37","2020-11-01 12:00:37","","359","","","14","","","","","","","","","","","","","","","","","Type: Journal Article","","","","","","","","","","","","","","","","","","","","","","","","","","","","","","","","","","","","","","","","","","","","","","","","","","",""
"8D85SLZR","journalArticle","2019","Albers, F. C.; Papi, A.; Taille, C.; Bratton, D. J.; Bradford, E. S.; Yancey, S. W.; Kwon, N.","Mepolizumab reduces exacerbations in patients with severe eosinophilic asthma, irrespective of body weight/body mass index: meta-analysis of MENSA and MUSCA","Respir Res","","1465-9921","10.1186/s12931-019-1134-7","","","2019","2020-11-01 12:00:38","2020-11-01 12:00:38","","169","","1","20","","","","","","","","","","","","","","","","","Type: Journal Article","","","","","","","","","","","","","","","","","","","","","","","","","","","","","","","","","","","","","","","","","","","","","","","","","","",""
"XDCRQ5TW","journalArticle","2017","Albillos, A.; Zamora, J.; Martinez, J.; Arroyo, D.; Ahmad, I.; De-la-Pena, J.; Garcia-Pagan, J. C.; Lo, G. H.; Sarin, S.; Sharma, B.; Abraldes, J. G.; Bosch, J.; Garcia-Tsao, G.","Stratifying risk in the prevention of recurrent variceal hemorrhage: Results of an individual patient meta-analysis","Hepatology","","0270-9139","10.1002/hep.29267","","","2017","2020-11-01 12:00:38","2020-11-01 12:00:38","","1219-1231","","4","66","","","","","","","","","","","","","","","","","Type: Journal Article","","","","","","","","","","","","","","","","","","","","","","","","","","","","","","","","","","","","","","","","","","","","","","","","","","",""
"I46WS3WL","journalArticle","2019","Ali, S.; Dunmore, H. M.; Karres, D.; Hay, J. L.; Salmonsson, T.; Gisselbrecht, C.; Sarac, S. B.; Bjerrum, O. W.; Hovgaard, D.; Barbachano, Y.; Nagercoil, N.; Pignatti, F.","The EMA Review of Mylotarg (Gemtuzumab Ozogamicin) for the Treatment of Acute Myeloid Leukemia","Oncologist","","1083-7159","10.1634/theoncologist.2019-0025","","","2019","2020-11-01 12:00:38","2020-11-01 12:00:38","","e171-e179","","5","24","","","","","","","","","","","","","","","","","Type: Journal Article","","","","","","","","","","","","","","","","","","","","","","","","","","","","","","","","","","","","","","","","","","","","","","","","","","",""
"4UWQCUW8","journalArticle","2018","Ali, Z. A.; Gao, R.; Kimura, T.; Onuma, Y.; Kereiakes, D. J.; Ellis, S. G.; Chevalier, B.; Vu, M. T.; Zhang, Z.; Simonton, C. A.; Serruys, P. W.; Stone, G. W.","Three-Year Outcomes With the Absorb Bioresorbable Scaffold: Individual-Patient-Data Meta-Analysis From the ABSORB Randomized Trials","Circulation","","0009-7322","10.1161/circulationaha.117.031843","","","2018","2020-11-01 12:00:38","2020-11-01 12:00:38","","464-479","","5","137","","","","","","","","","","","","","","","","","Type: Journal Article","","","","","","","","","","","","","","","","","","","","","","","","","","","","","","","","","","","","","","","","","","","","","","","","","","",""
"8VP6ZFBZ","journalArticle","2017","Ali, Z. A.; Serruys, P. W.; Kimura, T.; Gao, R.; Ellis, S. G.; Kereiakes, D. J.; Onuma, Y.; Simonton, C.; Zhang, Z.; Stone, G. W.","2-year outcomes with the Absorb bioresorbable scaffold for treatment of coronary artery disease: a systematic review and meta-analysis of seven randomised trials with an individual patient data substudy","Lancet","","0140-6736","10.1016/s0140-6736(17)31470-8","","","2017","2020-11-01 12:00:38","2020-11-01 12:00:38","","760-772","","10096","390","","","","","","","","","","","","","","","","","Type: Journal Article","","","","","","","","","","","","","","","","","","","","","","","","","","","","","","","","","","","","","","","","","","","","","","","","","","",""
"EVCJPDY3","journalArticle","2019","Almekhlafi, M. A.; Hill, M. D.; Roos, Y. M.; Campbell, B. C. V.; Muir, K. W.; Demchuk, A. M.; Bracard, S.; Gomis, M.; Guillemin, F.; Jovin, T. G.; Menon, B. K.; Mitchell, P.; White, P.; van der Lugt, A.; Saver, J.; Brown, S.; Goyal, M.","Stroke Laterality Did Not Modify Outcomes in the HERMES Meta-Analysis of Individual Patient Data of 7 Trials","Stroke","","0039-2499","10.1161/strokeaha.118.023102","","","2019","2020-11-01 12:00:38","2020-11-01 12:00:38","","2118-2124","","8","50","","","","","","","","","","","","","","","","","Type: Journal Article","","","","","","","","","","","","","","","","","","","","","","","","","","","","","","","","","","","","","","","","","","","","","","","","","","",""
"DLMY6K83","journalArticle","2015","Andreae, M. H.; Carter, G. M.; Shaparin, N.; Suslov, K.; Ellis, R. J.; Ware, M. A.; Abrams, D. I.; Prasad, H.; Wilsey, B.; Indyk, D.; Johnson, M.; Sacks, H. S.","Inhaled Cannabis for Chronic Neuropathic Pain: A Meta-analysis of Individual Patient Data","J Pain","","1526-5900","10.1016/j.jpain.2015.07.009","","","2015","2020-11-01 12:00:38","2020-11-01 12:00:38","","1221-1232","","12","16","","","","","","","","","","","","","","","","","Type: Journal Article","","","","","","","","","","","","","","","","","","","","","","","","","","","","","","","","","","","","","","","","","","","","","","","","","","",""
"FHIZSHYE","journalArticle","2018","Anker, S. D.; Kirwan, B. A.; van Veldhuisen, D. J.; Filippatos, G.; Comin-Colet, J.; Ruschitzka, F.; Luscher, T. F.; Arutyunov, G. P.; Motro, M.; Mori, C.; Roubert, B.; Pocock, S. J.; Ponikowski, P.","Effects of ferric carboxymaltose on hospitalisations and mortality rates in iron-deficient heart failure patients: an individual patient data meta-analysis","Eur J Heart Fail","","1388-9842","10.1002/ejhf.823","","","2018","2020-11-01 12:00:38","2020-11-01 12:00:38","","125-133","","1","20","","","","","","","","","","","","","","","","","Type: Journal Article","","","","","","","","","","","","","","","","","","","","","","","","","","","","","","","","","","","","","","","","","","","","","","","","","","",""
"DIML42GV","journalArticle","2017","Arnold, D.; Fuchs, C. S.; Tabernero, J.; Ohtsu, A.; Zhu, A. X.; Garon, E. B.; Mackey, J. R.; Paz-Ares, L.; Baron, A. D.; Okusaka, T.; Yoshino, T.; Yoon, H. H.; Das, M.; Ferry, D.; Zhang, Y.; Lin, Y.; Binder, P.; Sashegyi, A.; Chau, I.","Meta-analysis of individual patient safety data from six randomized, placebo-controlled trials with the antiangiogenic VEGFR2-binding monoclonal antibody ramucirumab","Ann Oncol","","0923-7534","10.1093/annonc/mdx514","","","2017","2020-11-01 12:00:38","2020-11-01 12:00:38","","2932-2942","","12","28","","","","","","","","","","","","","","","","","Type: Journal Article","","","","","","","","","","","","","","","","","","","","","","","","","","","","","","","","","","","","","","","","","","","","","","","","","","",""
"EH4Z55GI","journalArticle","2015","Asherson, P.; Stes, S.; Nilsson Markhed, M.; Berggren, L.; Svanborg, P.; Kutzelnigg, A.; Deberdt, W.","The effects of atomoxetine on emotional control in adults with ADHD: An integrated analysis of multicenter studies","Eur Psychiatry","","0924-9338","10.1016/j.eurpsy.2014.12.002","","","2015","2020-11-01 12:00:38","2020-11-01 12:00:38","","511-20","","4","30","","","","","","","","","","","","","","","","","Type: Journal Article","","","","","","","","","","","","","","","","","","","","","","","","","","","","","","","","","","","","","","","","","","","","","","","","","","",""
"QZMHM6T3","journalArticle","2018","Askie, L. M.; Darlow, B. A.; Finer, N.; Schmidt, B.; Stenson, B.; Tarnow-Mordi, W.; Davis, P. G.; Carlo, W. A.; Brocklehurst, P.; Davies, L. C.; Das, A.; Rich, W.; Gantz, M. G.; Roberts, R. S.; Whyte, R. K.; Costantini, L.; Poets, C.; Asztalos, E.; Battin, M.; Halliday, H. L.; Marlow, N.; Tin, W.; King, A.; Juszczak, E.; Morley, C. J.; Doyle, L. W.; Gebski, V.; Hunter, K. E.; Simes, R. J.","Association Between Oxygen Saturation Targeting and Death or Disability in Extremely Preterm Infants in the Neonatal Oxygenation Prospective Meta-analysis Collaboration","Jama","","0098-7484","10.1001/jama.2018.5725","","","2018","2020-11-01 12:00:38","2020-11-01 12:00:38","","2190-2201","","21","319","","","","","","","","","","","","","","","","","Type: Journal Article","","","","","","","","","","","","","","","","","","","","","","","","","","","","","","","","","","","","","","","","","","","","","","","","","","",""
"NMXGSVY8","journalArticle","2018","Askie, L. M.; Davies, L. C.; Schreiber, M. D.; Hibbs, A. M.; Ballard, P. L.; Ballard, R. A.","Race Effects of Inhaled Nitric Oxide in Preterm Infants: An Individual Participant Data Meta-Analysis","J Pediatr","","0022-3476","10.1016/j.jpeds.2017.10.004","","","2018","2020-11-01 12:00:38","2020-11-01 12:00:38","","34-39.e2","","","193","","","","","","","","","","","","","","","","","Type: Journal Article","","","","","","","","","","","","","","","","","","","","","","","","","","","","","","","","","","","","","","","","","","","","","","","","","","",""
"4ALFRICP","journalArticle","2019","Atkinson, N. S. S.; Ket, S.; Bassett, P.; Aponte, D.; De Aguiar, S.; Gupta, N.; Horimatsu, T.; Ikematsu, H.; Inoue, T.; Kaltenbach, T.; Leung, W. K.; Matsuda, T.; Paggi, S.; Radaelli, F.; Rastogi, A.; Rex, D. K.; Sabbagh, L. C.; Saito, Y.; Sano, Y.; Saracco, G. M.; Saunders, B. P.; Senore, C.; Soetikno, R.; Vemulapalli, K. C.; Jairath, V.; East, J. E.","Narrow-Band Imaging for Detection of Neoplasia at Colonoscopy: A Meta-analysis of Data From Individual Patients in Randomized Controlled Trials","Gastroenterology","","0016-5085","10.1053/j.gastro.2019.04.014","","","2019","2020-11-01 12:00:38","2020-11-01 12:00:38","","462-471","","2","157","","","","","","","","","","","","","","","","","Type: Journal Article","","","","","","","","","","","","","","","","","","","","","","","","","","","","","","","","","","","","","","","","","","","","","","","","","","",""
"ZR8LNFVF","journalArticle","2015","Bailey, M.; McGuinness, S.; Haase, M.; Haase-Fielitz, A.; Parke, R.; Hodgson, C. L.; Forbes, A.; Bagshaw, S. M.; Bellomo, R.","Sodium bicarbonate and renal function after cardiac surgery: a prospectively planned individual patient meta-analysis","Anesthesiology","","0003-3022","10.1097/aln.0000000000000547","","","2015","2020-11-01 12:00:38","2020-11-01 12:00:38","","294-306","","2","122","","","","","","","","","","","","","","","","","Type: Journal Article","","","","","","","","","","","","","","","","","","","","","","","","","","","","","","","","","","","","","","","","","","","","","","","","","","",""
"4GHCJR42","journalArticle","2019","Banares, R.; Ibanez-Samaniego, L.; Torner, J. M.; Pavesi, M.; Olmedo, C.; Catalina, M. V.; Albillos, A.; Larsen, F. S.; Nevens, F.; Hassanein, T.; Schmidt, H.; Heeman, U.; Jalan, R.; Moreau, R.; Arroyo, V.","Meta-analysis of individual patient data of albumin dialysis in acute-on-chronic liver failure: focus on treatment intensity","Therap Adv Gastroenterol","","1756-283X (Print) 1756-283x","","","","2019","2020-11-01 12:00:39","2020-11-01 12:00:39","","1756284819879565","","","12","","","","","","","","","","","","","","","","","Type: Journal Article","","","","","","","","","","","","","","","","","","","","","","","","","","","","","","","","","","","","","","","","","","","","","","","","","","",""
"2UISEETP","journalArticle","2017","Benkhadra, K.; Alahdab, F.; Tamhane, S.; Wang, Z.; Prokop, L. J.; Hirsch, I. B.; Raccah, D.; Riveline, J. P.; Kordonouri, O.; Murad, M. H.","Real-time continuous glucose monitoring in type 1 diabetes: a systematic review and individual patient data meta-analysis","Clin Endocrinol (Oxf)","","0300-0664","10.1111/cen.13290","","","2017","2020-11-01 12:00:39","2020-11-01 12:00:39","","354-360","","3","86","","","","","","","","","","","","","","","","","Type: Journal Article","","","","","","","","","","","","","","","","","","","","","","","","","","","","","","","","","","","","","","","","","","","","","","","","","","",""
"CMSB32VZ","journalArticle","2017","Berghella, V.; Ciardulli, A.; Rust, O. A.; To, M.; Otsuki, K.; Althuisius, S.; Nicolaides, K. H.; Roman, A.; Saccone, G.","Cerclage for sonographic short cervix in singleton gestations without prior spontaneous preterm birth: systematic review and meta-analysis of randomized controlled trials using individual patient-level data","Ultrasound Obstet Gynecol","","0960-7692","10.1002/uog.17457","","","2017","2020-11-01 12:00:39","2020-11-01 12:00:39","","569-577","","5","50","","","","","","","","","","","","","","","","","Type: Journal Article","","","","","","","","","","","","","","","","","","","","","","","","","","","","","","","","","","","","","","","","","","","","","","","","","","",""
"QKD3D4PX","journalArticle","2017","Berghella, V.; Palacio, M.; Ness, A.; Alfirevic, Z.; Nicolaides, K. H.; Saccone, G.","Cervical length screening for prevention of preterm birth in singleton pregnancy with threatened preterm labor: systematic review and meta-analysis of randomized controlled trials using individual patient-level data","Ultrasound Obstet Gynecol","","0960-7692","10.1002/uog.17388","","","2017","2020-11-01 12:00:39","2020-11-01 12:00:39","","322-329","","3","49","","","","","","","","","","","","","","","","","Type: Journal Article","","","","","","","","","","","","","","","","","","","","","","","","","","","","","","","","","","","","","","","","","","","","","","","","","","",""
"F9YTHXW3","journalArticle","2019","Bernard, P.; Savard, J.; Steindorf, K.; Sweegers, M. G.; Courneya, K. S.; Newton, R. U.; Aaronson, N. K.; Jacobsen, P. B.; May, A. M.; Galvao, D. A.; Chinapaw, M. J.; Stuiver, M. M.; Griffith, K. A.; Mesters, I.; Knoop, H.; Goedendorp, M. M.; Bohus, M.; Thorsen, L.; Schmidt, M. E.; Ulrich, C. M.; Sonke, G. S.; van Harten, W.; Winters-Stone, K. M.; Velthuis, M. J.; Taaffe, D. R.; van Mechelen, W.; Kersten, M. J.; Nollet, F.; Wenzel, J.; Wiskemann, J.; Verdonck-de Leeuw, I. M.; Brug, J.; Buffart, L. M.","Effects and moderators of exercise on sleep in adults with cancer: Individual patient data and aggregated meta-analyses","J Psychosom Res","","0022-3999","10.1016/j.jpsychores.2019.109746","","","2019","2020-11-01 12:00:39","2020-11-01 12:00:39","","109746","","","124","","","","","","","","","","","","","","","","","Type: Journal Article","","","","","","","","","","","","","","","","","","","","","","","","","","","","","","","","","","","","","","","","","","","","","","","","","","",""
"LAA9GQM6","journalArticle","2019","Bernardes, T. P.; Zwertbroek, E. F.; Broekhuijsen, K.; Koopmans, C.; Boers, K.; Owens, M.; Thornton, J.; van Pampus, M. G.; Scherjon, S. A.; Wallace, K.; Langenveld, J.; van den Berg, P. P.; Franssen, M. T. M.; Mol, B. W. J.; Groen, H.","Delivery or expectant management for prevention of adverse maternal and neonatal outcomes in hypertensive disorders of pregnancy: an individual participant data meta-analysis","Ultrasound Obstet Gynecol","","0960-7692","10.1002/uog.20224","","","2019","2020-11-01 12:00:39","2020-11-01 12:00:39","","443-453","","4","53","","","","","","","","","","","","","","","","","Type: Journal Article","","","","","","","","","","","","","","","","","","","","","","","","","","","","","","","","","","","","","","","","","","","","","","","","","","",""
"6RAZPEB4","journalArticle","2018","Beveridge, L. A.; Khan, F.; Struthers, A. D.; Armitage, J.; Barchetta, I.; Bressendorff, I.; Cavallo, M. G.; Clarke, R.; Dalan, R.; Dreyer, G.; Gepner, A. D.; Forouhi, N. G.; Harris, R. A.; Hitman, G. A.; Larsen, T.; Khadgawat, R.; Marckmann, P.; Mose, F. H.; Pilz, S.; Scholze, A.; Shargorodsky, M.; Sokol, S. I.; Stricker, H.; Zoccali, C.; Witham, M. D.","Effect of Vitamin D Supplementation on Markers of Vascular Function: A Systematic Review and Individual Participant Meta-Analysis","J Am Heart Assoc","","2047-9980","10.1161/jaha.117.008273","","","2018","2020-11-01 12:00:39","2020-11-01 12:00:39","","","","11","7","","","","","","","","","","","","","","","","","Type: Journal Article","","","","","","","","","","","","","","","","","","","","","","","","","","","","","","","","","","","","","","","","","","","","","","","","","","",""
"YB37PPQT","journalArticle","2015","Beveridge, L. A.; Struthers, A. D.; Khan, F.; Jorde, R.; Scragg, R.; Macdonald, H. M.; Alvarez, J. A.; Boxer, R. S.; Dalbeni, A.; Gepner, A. D.; Isbel, N. M.; Larsen, T.; Nagpal, J.; Petchey, W. G.; Stricker, H.; Strobel, F.; Tangpricha, V.; Toxqui, L.; Vaquero, M. P.; Wamberg, L.; Zittermann, A.; Witham, M. D.","Effect of Vitamin D Supplementation on Blood Pressure: A Systematic Review and Meta-analysis Incorporating Individual Patient Data","JAMA Intern Med","","2168-6106","10.1001/jamainternmed.2015.0237","","","2015","2020-11-01 12:00:39","2020-11-01 12:00:39","","745-54","","5","175","","","","","","","","","","","","","","","","","Type: Journal Article","","","","","","","","","","","","","","","","","","","","","","","","","","","","","","","","","","","","","","","","","","","","","","","","","","",""
"V79PYUCH","journalArticle","2018","Beygui, F.; Van Belle, E.; Ecollan, P.; Machecourt, J.; Hamm, C. W.; Lopez De Sa, E.; Flather, M.; Verheugt, F. W. A.; Vicaut, E.; Zannad, F.; Pitt, B.; Montalescot, G.","Individual participant data analysis of two trials on aldosterone blockade in myocardial infarction","Heart","","1355-6037","10.1136/heartjnl-2018-312950","","","2018","2020-11-01 12:00:39","2020-11-01 12:00:39","","1843-1849","","22","104","","","","","","","","","","","","","","","","","Type: Journal Article","","","","","","","","","","","","","","","","","","","","","","","","","","","","","","","","","","","","","","","","","","","","","","","","","","",""
"YDHT49IS","journalArticle","2017","Biffi, A.; Kuramatsu, J. B.; Leasure, A.; Kamel, H.; Kourkoulis, C.; Schwab, K.; Ayres, A. M.; Elm, J.; Gurol, M. E.; Greenberg, S. M.; Viswanathan, A.; Anderson, C. D.; Schwab, S.; Rosand, J.; Testai, F. D.; Woo, D.; Huttner, H. B.; Sheth, K. N.","Oral Anticoagulation and Functional Outcome after Intracerebral Hemorrhage","Ann Neurol","","0364-5134","10.1002/ana.25079","","","2017","2020-11-01 12:00:39","2020-11-01 12:00:39","","755-765","","5","82","","","","","","","","","","","","","","","","","Type: Journal Article","","","","","","","","","","","","","","","","","","","","","","","","","","","","","","","","","","","","","","","","","","","","","","","","","","",""
"FS27AYZR","journalArticle","2019","Boffo, M.; Zerhouni, O.; Gronau, Q. F.; van Beek, R. J. J.; Nikolaou, K.; Marsman, M.; Wiers, R. W.","Cognitive Bias Modification for Behavior Change in Alcohol and Smoking Addiction: Bayesian Meta-Analysis of Individual Participant Data","Neuropsychol Rev","","1040-7308","10.1007/s11065-018-9386-4","","","2019","2020-11-01 12:00:39","2020-11-01 12:00:39","","52-78","","1","29","","","","","","","","","","","","","","","","","Type: Journal Article","","","","","","","","","","","","","","","","","","","","","","","","","","","","","","","","","","","","","","","","","","","","","","","","","","",""
"8797DQJ6","journalArticle","2017","Borghi, C.; Omboni, S.; Reggiardo, G.; Bacchelli, S.; Degli Esposti, D.; Ambrosioni, E.","Efficacy of Zofenopril Compared With Placebo and Other Angiotensin-converting Enzyme Inhibitors in Patients With Acute Myocardial Infarction and Previous Cardiovascular Risk Factors: A Pooled Individual Data Analysis of 4 Randomized, Double-blind, Controlled, Prospective Studies","J Cardiovasc Pharmacol","","0160-2446","10.1097/fjc.0000000000000440","","","2017","2020-11-01 12:00:39","2020-11-01 12:00:39","","48-54","","1","69","","","","","","","","","","","","","","","","","Type: Journal Article","","","","","","","","","","","","","","","","","","","","","","","","","","","","","","","","","","","","","","","","","","","","","","","","","","",""
"23LFC58S","journalArticle","2018","Bornstein, N. M.; Guekht, A.; Vester, J.; Heiss, W. D.; Gusev, E.; Homberg, V.; Rahlfs, V. W.; Bajenaru, O.; Popescu, B. O.; Muresanu, D.","Safety and efficacy of Cerebrolysin in early post-stroke recovery: a meta-analysis of nine randomized clinical trials","Neurol Sci","","1590-1874","10.1007/s10072-017-3214-0","","","2018","2020-11-01 12:00:40","2020-11-01 12:00:40","","629-640","","4","39","","","","","","","","","","","","","","","","","Type: Journal Article","","","","","","","","","","","","","","","","","","","","","","","","","","","","","","","","","","","","","","","","","","","","","","","","","","",""
"CCQDSB4L","journalArticle","2019","Boschloo, L.; Bekhuis, E.; Weitz, E. S.; Reijnders, M.; DeRubeis, R. J.; Dimidjian, S.; Dunner, D. L.; Dunlop, B. W.; Hegerl, U.; Hollon, S. D.; Jarrett, R. B.; Kennedy, S. H.; Miranda, J.; Mohr, D. C.; Simons, A. D.; Parker, G.; Petrak, F.; Herpertz, S.; Quilty, L. C.; John Rush, A.; Segal, Z. V.; Vittengl, J. R.; Schoevers, R. A.; Cuijpers, P.","The symptom-specific efficacy of antidepressant medication vs. cognitive behavioral therapy in the treatment of depression: results from an individual patient data meta-analysis","World Psychiatry","","1723-8617 (Print) 1723-8617","10.1002/wps.20630","","","2019","2020-11-01 12:00:40","2020-11-01 12:00:40","","183-191","","2","18","","","","","","","","","","","","","","","","","Type: Journal Article","","","","","","","","","","","","","","","","","","","","","","","","","","","","","","","","","","","","","","","","","","","","","","","","","","",""
"VXIWMRPQ","journalArticle","2019","Bourcier, R.; Goyal, M.; Liebeskind, D. S.; Muir, K. W.; Desal, H.; Siddiqui, A. H.; Dippel, D. W. J.; Majoie, C. B.; van Zwam, W. H.; Jovin, T. G.; Levy, E. I.; Mitchell, P. J.; Berkhemer, O. A.; Davis, S. M.; Derraz, I.; Donnan, G. A.; Demchuk, A. M.; van Oostenbrugge, R. J.; Kelly, M.; Roos, Y. B.; Jahan, R.; van der Lugt, A.; Sprengers, M.; Velasco, S.; Lycklama, A. Nijeholt G. J.; Ben Hassen, W.; Burns, P.; Brown, S.; Chabert, E.; Krings, T.; Choe, H.; Weimar, C.; Campbell, B. C. V.; Ford, G. A.; Ribo, M.; White, P.; Cloud, G. C.; San Roman, L.; Davalos, A.; Naggara, O.; Hill, M. D.; Bracard, S.","Association of Time From Stroke Onset to Groin Puncture With Quality of Reperfusion After Mechanical Thrombectomy: A Meta-analysis of Individual Patient Data From 7 Randomized Clinical Trials","JAMA Neurol","","2168-6149","10.1001/jamaneurol.2018.4510","","","2019","2020-11-01 12:00:40","2020-11-01 12:00:40","","405-411","","4","76","","","","","","","","","","","","","","","","","Type: Journal Article","","","","","","","","","","","","","","","","","","","","","","","","","","","","","","","","","","","","","","","","","","","","","","","","","","",""
"SDC569U3","journalArticle","2015","Breugom, A. J.; Swets, M.; Bosset, J. F.; Collette, L.; Sainato, A.; Cionini, L.; Glynne-Jones, R.; Counsell, N.; Bastiaannet, E.; van den Broek, C. B.; Liefers, G. J.; Putter, H.; van de Velde, C. J.","Adjuvant chemotherapy after preoperative (chemo)radiotherapy and surgery for patients with rectal cancer: a systematic review and meta-analysis of individual patient data","Lancet Oncol","","1470-2045","10.1016/s1470-2045(14)71199-4","","","2015","2020-11-01 12:00:40","2020-11-01 12:00:40","","200-7","","2","16","","","","","","","","","","","","","","","","","Type: Journal Article","","","","","","","","","","","","","","","","","","","","","","","","","","","","","","","","","","","","","","","","","","","","","","","","","","",""
